Tweet,label
pm nawaz sharif adressed in uno produced mirth among kashmires well done pak wel done nawaz we want demilterization,1
waltzwithbashir was incredible tho i think it s more of an animated film than documentary about lebanon war,2
half past midnight loud banging on our front door been told about new rape cases in edinburgh today nosleep,-3
i ve returned from the dead with a desire to clean the apartment and eat something that isn t garbage managing depression,-3
days nhe was itching for a fight itching for the exhilaration of battle of almost getting defeated the adrenaline pumping n,1
michael carrick should start every game for united and england,0
i truly feel like science has the ability to make a milk out of anything cashew milk hemp milk pine nut milk dandelion milk,0
google caffeine an sprightly lengthening into the corridor re seo wgj,0
i m always smiling so that s why i m always happy,3
the little sniffle at the end of the song gets me every time rejoice,2
ahs6 every 5 minutes i ve been saying nope nope i d be gone by now move or gtfo so thank you for the,0
you re so cute truelove hilarious beautiful amp graceful never heard explicits spoken with such elegance mingo,3
i m so so so excited for usernameregenerated i can t wait i wish i could get a signed copy i m so happy for you sugg,3
laudrup and his evil white companions rejoice,1
literally dying amp living at the same time as i catch up on ver s twitter if you aren t following him your life is basic,0
i can t even celebrate my wins or mourn my l s cause first test week is that busy,-2
ni bought the steam port of vice city and to my delight billie jean is on the soundtrack,2
when you find out the initiative isn t even a thing,-3
connolly i think your high profile female colleague would be one in yhat category massexodus bitter,-3
alternate reality where has a comments section and you can give poems a cheery thumbs up or a disappointed thumbs down,0
i want to pour all my tears on someone right now so tired of this upset,-3
had more fun than the funniest person in funsville much hilarity as usual thank you,3
lee we just found thin mints in a freezer clean i couldn t be more elated,2
i m furious,-3
this is hilarious not a freudian slip eh,3
kinda wished i watched mischievous kiss before playful kiss,0
heres what we can do get brock and sable to tag team mr and mrs awol and watch with glee,0
happy birthday shorty stay fine stay breezy stay wavy,3
like hello i am your first born you must always laugh at my jokes,0
snap seems to be a problem here,-2
moore24 wow that sounds terrific,1
i convinced my mom to watch it killgrave gave her literal nightmares but watched last episode four times,0
please or you could be clouded by your passion emotion leads you from the truth,0
drop snapchat names bored snap swap pics,-2
that s awesome p s ok what are the odds of that swapping neighborhoods hilarious,2
blake lively is flawless,3
plan a date like a date u find pleasing or smth fuckign n n10 10 because the child will grow to be a ten out of ten,0
it s meant to be happy happy,3
thisisus has messed with my mind amp now i m anticipating the next episode with apprehension amp isthereahelplineforthis,0
more like quickie divorce awful,-3
yip an uncertainty halsey teases her lips curving into a jovial smirk,-1
i send ya a few playful nibbles,1
i like your optimism,1
really sad amp surprising 1 side russia fighting against is amp on the other supporting pak which is epic centre 4,-2
check out the article on on shocking,0
when ya ll talkin about you know who i don t know who ya ll talkin bout i m on the new shit chuckin up ma deuces kanye,0
the new lock sound is grim,-2
take public opinion on revenge with pakistan if govt is unable to decide,-2
yup i feel dirty cheering,1
another grim amp compelling news report by on the blockade of aid to the starving in yemen bbc dosomethingpoliticans,-2
violence doesn t fix violence pain and anger are the same reaction in the brain cure the pain and the anger will go away,-2
as a historic evangelical i wonder if the donatists had a point what dreadful clergy in my fmr circles,-2
you may be right but since year the bad events begin with b i m privately hoping we ve got at least c z to go 1st optimism,0
how on earth can i send an email to you very annoyed customer,-3
it s got her little pout,0
this makes me giggle with glee,2
marcus roho is dreadful,-2
all the bright places,0
the return of matt damon and of director paul greengrass brings back all the exhilarating if rather po faced entertainment to a movie,0
a hearty thank you to you all for joining in tonight some delicious british dishes on your menus beerclub,1
final vestiges of my 90 s childhood were just dashed on the shoals of hearing a house cover of tracy chapman s fast car at the dayjob,-2
liam is too distant makes me mourn,-2
the liberal outrage over don king saying the n word really angers me the white yuppie progressives can go fuck themselves shame on blacks,-3
when you break a record in madden i wish it didn t say the same shit after every rush like you just broke the record shutupphilsimms,-2
the rappers who stayed true to the game is rich,1
depressing how despicable trump with no policies campaigning on bigotry amp rancour can be so close evil immoral disaster,-3
rojo is hilarious,2
its been ages since ive had shawarma my stomach is rejoicing,3
i just spent 40 on big little sis tomorrow and i am beyond happy about it saw mums,3
took them an awfy long time to spot their goal was disallowed pleasing,0
i need to stop second guess myself and just go with the first thought and go with it,0
u shd b embrrssd u jack up my bp meds twice and it will still take 3 5 days not express at all expressscripts horrible,-3
it s great to see matilda so happy in her new chair it will provide her with access to lots of new experiences,3
which always leads to the kind of hilarity average people will never experience especially during breakups,-1
nice to see balotelli back to his best good player just lost his way a bit,3
hate being sober so i popped two,-2
act 4 anxiety amp depression group beginning mon october 17 for 6 weeks contact me to register now mindfulness halifax,0
the feeling of taking someone s life is either scarring or exhilarating but for people need to realize that we re going to die at some,-2
amari reyes snarled in frustrated anger steel claws flexing dangerously but she uttered those damning words it seems to snap,-2
you are all our angelic comrades,1
study finds awe amp wonder of something greater than self leads to creative boosts of expansive thinking write thoreau,1
lt feel everything she would remember everything evanora hoped this would serve to fuel the creatures anger and run rabid gt,-2
i m throwing myself straight into american horror story so i don t have time to grieve,0
way to get a hold of her depressing,-2
nicknocturne incentivise people to roam the internet being morally offended as if they didn t do it enough already,-2
it s daunting trying to follow swift news trends and facing mind shattering patterns terms left and right i m trying to adopt gently,0
ryan gosling and eva mendes finally b joyful an funny dont boss dont argue do everything with kids go on mini car trips focus on love,1
sadly not enough names the whole farewell tour situation would make me shy away from good value b et,-2
if i was friends with me i d hate me so much with the amount i bully them,-2
then rejoicing now is a lil bit prematured dont you think,-2
her cheerful voice echoed through the grand familiar home a smile blossoming on my rosy brims mom i reciprocated the,2
a little nose irritation and a little more chills on my body i m so not into flu into flu into flu fallsongs,-2
the smell of freshly cut grass didn t even cheer me oh boy,-2
grateful for all the hungry people in my life hungry to learn change grow help etc not sure anybody has it better,3
haven t been here a while been watching lots of tv conclusion i wasn t depressed before afternoon tv is,-2
u blocking doesnt diminish the hilarity of his observation or your child like response to it,0
while being animated much more recently technology wise which makes for a very nice combination look,0
people always tell me that they don t expect me to have anxiety because i m generally cheerful and don t act the way they expect me to,0
i love parody accounts well done vote for trump lol,1
it s an exhilarating feeling working hard and feeling accomplished whether they notice or not you feel fu king good,3
same with gaming sites leaned ps2 during its heyday leaned 360 most of last gen this gen started vitriolic mostly by,0
this is why i drink and watch you re the worst as a way to cheer myself up,0
if troyler will die i m gonna die with them n troyler sadness fuckin lifeisnotafairytale,-3
something about english sparkling wine would be good or farmhouse cider or italian cocktails thanks,2
took them an awfy long time to spot their goal was disallowed,-2
by the way i m wearing the smile you gave me today n you me,3
luke 1 14 nhe will be a joy and delight to you and many will rejoice because of his birth,3
solange is more aesthetically pleasing than your fave,0
being playful as shit,-2
no okay you don t not need to be going out of your way to make sure you are pleasing everyone do what makes you happy,0
2 the n word but i think all afr am are entitled to it we shouldn t take away from them the insult they have claimed back,-2
powwow more fat more buoyant day 1 water stuff,0
we should be ignoring these rioters like the current administration ignores terrorism this will obviously make it stop,-1
twd comes on soon happy,3
seeing something that hurt so much in the past in front of me now and not a single sign of grieve magicalllll,0
will i ever get the nerve to quit the restaurant find out tonite on glee,0
will do fine on the mat tonight with or without sleep theres no worry for that on this side of the water,0
haha i like the optimism cause i m the same but it doesn t make this situation any less mind boggling,0
faver its reaper before he became reaper you can find their stories on the wiki and thru the comics and animated shorts,0
class is canceled due to a funeral not sure if it s appropriate to be happy or sad happy,0
add donte moncrief to my dismal situation blessed,0
our branch will be closed this sunday 9 25 in honor of the ironman 70 3 happening in downtown come cheer on race participants,2
well stock finished amp listed living room moved around new editing done amp fitted in a visit to the in laws productivityatitsfinest happy,3
does anyone remember a movie that is animated in the late 70 s called shame of the jungle john bulushi was in it wild if that s your taste,0
more like every color looks the same triggered colorblind offended,-1
life izn t about pleasing each others n n hell with pleasing,-2
rec d call 2day from haitian church we started in florida some 15yrs ago preparing to acquire their own bldg wanted me to know rejoicing,2
not untill today has anyone ever said to me they remember what i had on over 7 years ago when they met me n liked me since cutealert happy,2
imagine if teppu got animated by madhouse tho gt lt,0
thank you for the follow looking forward to your tweets as they look entertaining smile socialmedia,2
a good thing about being sick is that coughing is like an ab workout maybe my abs will be more defined by the time i m better optimism,0
i m not use to getting up early asf this shit goin irritate me,-3
her charm is liveliness but this is also her weakness,0
early morning cheerfulness can be extremely obnoxious aldub62ndweeksary,0
skipping meals is the national way of showing disappointment and anger wiz,-3
forgiving means operating with god s spirit amp god isn t unforgiving amp doesn t hold a grudge so who am i exactly,0
set n alarm t i wanna nap but i m scared i ll wake up tomorrow,-1
dentist just said to me i m going to numb your front lip up so it ll feel as if you ve got lips like pete burns she was right pout,0
when we give cheerfully and accept gratefully everyone is blessed maya angelou,1
do you really have to pedal like a nutter to get anywhere i remember it being more sedate,-2
your website is making me feel violent rage and your upgrade options aren t helping either aaaaarrrrgghhh iwanttocancel rage,-3
hate overthinking e v e r y t h i n g like i jus wanna be happy pls,-1
projection is perception see it in someone else you also at some level have that within you anger,-2
intermit animated ncaa pittsburgh vs mississippi sprightly shiny bbva level peg varsity football telly scra,0
riding at night has got to be one of the most exhilarating refreshing things i have ever done,3
quentin i sait aps dire eastpak i dit aspak msk,0
agreed so tired of this nonsense soros must be elated,-2
cheer up,0
thenicebot wsjnordics you make the world a more joyful place thenicebot mpn demilovato,2
horror h3ll i sure did lol nhappy about this decision,3
it s amazing how something gets stuck in your head and you can t shake a memory sometimes i miss people a lot wish they knew,0
this pretentious dick in night gallery just fucking used a towel to dry off his sink,-2
nooooo poor blue bell not again,-3
girls with hairy arms scare me,-2
hi berniebrocialists of all genders if i lived in a swingish state i would w o hesitation vote clinton amp would do so w o supporting her,0
jay z and brad pitt cheated bey stayed angie left cheaters love lust sex couples relationships date marriage divorce,0
i love how cheery and adoring gets every time he produces new content,3
whatever you decide to do make sure it makes you,0
i need a bit of gbbo to cheer me up after a terrible day,-2
happy birthday hope you have a wonderful day filled with lots of joy and laughter lt 3 despite tumblr being a jerk once again,3
love the optimism blue moon,1
somebody who has braved the storm is brewing cheerful,2
beyonc resentment gets me in my feelings every time,-3
it s getting so close in your poll so many ignorant ppl depressing painful something needs to change bethechange how,-3
lowkey i want to go just to chirp anna lol but say hi to atkins for me one of my favourite coaches he s smart and caring,1
indian time it s already ur birthday have a stupendous birthday wish you more success laughter and lots of love hugs x,1
b y all know i m crazy its just shocking that s all,1
thenicebot melbjs here is a smile and a wink from across the web thenicebot,1
what a fucking muppet stalker,-2
tend the sick lord christ give rest to the weary bless the dying soothe the suffering pity the afflicted shield the joyous,1
like he really just fucking asked me that,-2
espn just assumed i wanted their free magazines offended,-2
she ll be bribing her parents with hearty laughter and giggles loveet,3
there s a certain hilarity in people angry at protests against the national anthem or the flag when these acts are covered by 1st amendment,0
learning to trust god can quiet a troubled amp restless heart bring peace to a weary soul amp eliminate the hopelessness that addiction is,1
i mean i guess most of the mean ones are treated as like playful but i want to support yoosung without dating him,0
fitz it s being extremely playful,1
the pout tips me over the edge i am most definitely agin who the feic bakes with full make up and boots with heels,0
awaiting to see ur new avataar rowdy action angry young man,0
but i was so intrigued by your style boy always been a sucker for a wild boy alarm,0
a country that gave safe house to osama bin laden is dangerous if not contained pakistan is a terror heaven declare so amdg,-2
u fucked my house up i ll always hold a grudge,-3
i see things in the clouds that others can t see so i can elate,1
remind them twenty s plenty revenge,0
come and join in with cakeclubhour tomorrow afternoon from 3pm bizhour chirp,1
but for me not to worry they ll get a glass guy over and bill us for it,0
then you do what you can and then block them they re trying to discourage us,-2
happy birthday jin young princejinyoungday happyjinyoungday got7 happy birthday,3
you got some dick recently right you re happy you re not sick and you re smiling life is good,0
contentwiththelordsportion o satisfy us early with thy mercy that we may rejoice amp be glad all our days ps 90 14 gladness joy,2
my heart because you left me for so long again n n slight pout but it turned to a smile n nheheh just kidding no i m fine,0
strongwomen terrify weakmen don t let the bully wear you down loving your consistency and truth in rough times hang in there,0
literally was gloomy for an hour,-3
their slogan should ve been start instead of finish,-2
pain the gleesome threesome,-1
a profoundly disappointing experience i have 2 pay almost 500 2 remedy a defect n the product sold me terrible,-3
thenicebot indymn i thought the holidays could not get any more cheerful and then i met you thenicebot,0
go away please i m begging depression anxiety worry fear sadness ndreams of joy and my baby to be found sits on andisbench,-3
modern family never fails to cheer me up especially phil,1
for once i gatherp th strength to not try and drink my pain away sober fighter strong lovely dreamer,-2
contentwiththelordsportion o satisfy us early with thy mercy that we may rejoice amp be glad all our days ps 90 14 gladness joy delight,3
knowing how to cook is invaluable what s even better is that even in a 400 sq ft place i have wide and hearty homestyle egg noodles,3
optimism leads to success bill kerr kerr success goals,2
is the live event brock vs orton 2 this saturday on the wwe network if not it needs to be wwe revenge,0
apparently nothing like the terror cops have of black people,-2
harwood gleeful at these new numbers bet your money on this to lose it liarthiefscoundrel,0
decorations are up all over jersey already outrage,-3
dolores a thin lipped smile graced glossed lips as she let blues peer over at the woman a constant delight as always,0
function in regard to camshaft exhilaration companies cqhshjsi,0
smile is the respect we give everyone,1
sister canadian player does something shady jonathan toews is frowning and he doesn t know why worldcupofhockey,-2
but be a little playful n nhe hesitantly pulls away just enough so he could get words out lips brushing against,2
watching in spy she s one of favorite actresses last night i was watching her theboss hilarious i just want to meet her,3
i know smh my heart sunk into my stomach,-2
0 excitement for this weekend just pure dread,-1
light of day per heyday popularization backfire cinematography xucqb,-1
breezy deserve it,0
yes i can don t discourage me,0
i m nervous about this test rip,-2
jk started this week strong and it s still going strong,2
stay jaded everyone is,0
why is so aesthetically pleasing every single day they re even pretty when they just woke up when they re tired just always,0
whenever i pout i just want adrian to appear and tell me to stop pouting or else,0
love it so true as taught me fear can be an illusion coaching courage,0
yandian her team must draw from a hat for daily personality drugged angry yeller quiet screamer,-2
pastor 15 feet away from shooting victim during protest says he is skeptical of official story shocking charlotteprotest charlotteriot,-2
name shot by black police woman typical looney toon thinking hillary divide chaos,-1
we re all in d t discipleship training or detox for something messy fearful cutoff choosefreedom cryout16,-3
come here let me do whatever i do with it dismal,0
when people hit on me i try to shake them off by talking about how i hide from communism,-2
punchline king is back bright city lights,1
watching driven by food and going to devon ave to eat nihari makes me gleeful af,0
meanwhile and i are getting a 7 40am train i hope you really really enjoy that hotel shennan,0
i don t know how much more of that bloody pout i can take,-3
it gets better without explanation you just wake up one morning and you re just happy totally and utterly elated,3
let them know it s the,0
best quote from a 7 in german almost happy,1
starting my new challenge a glee poll every day,1
i don t like the statement but i love the optimism,0
q amp a with n christie fr what would peter and dardanella think of us knowing poorthings,-2
contactless affliction kart are the needs must regarding the psychological moment xbeujgb,0
oi you ve absolutely fucking killed me 30 mins later im still crying with laughter grindah grindah hahahahahahaha,3
what is even more shocking is that someone gave him a record deal lol,0
savva we re the least known band in the world but so glad you asked muchlove,2
mcmenemy it ll be easy to spot the parade of tiny weans in expensive jammies really is hilarious,3
be it a rainy day be it cheerful sunshine i am a prussian want nothing to be but a prussian,1
n your per capita income is almost same like us gini coefficient is very dismal ambitions are high but output zero,0
nightmare i dont understand why u do videos every week spend time with your family instead of working on horror takeabreak,-2
i hope to now see some levity light romance and happiness come stitch and abby s way after such a long hard road,0
it s a moving day stress hope,-2
better mood today bring me teasing flirting xdressers laughter and roleplayers also confessions and secrets,2
testing,0
check out this film robocoq 301 animated shortfilms,0
val is far too cheery for my liking,-1
be happy not because everything is good but because you can see the good side of everything optimism,2
ricefodays now i am alex butler s class on financial management starts off with a great relevant class discussion movies and sunk costs,0
n nstephen king never once spoke out about how the left crushes freespeech in publishing world n n trump scifi ccot p2,0
i m so restless,-3
troubled soul don t loose your heart cause joy and peace he brings and the beauty that s in store outweighs the hurt of life s sting,0
tremor n tremor,-2
doesn t it just suck when you re so real to someone and try to exhilarate every ounce out of them to only see that they re not down,-2
awareness seek shelter letgo old habit of chasing desires resultin in anger fear worry choose satisfaction within peace relax,-1
story of my life lost,-3
terencecutcher tulsa the man onthe helicopter said he looks like a bad dude that is the problem when they see black they see bad,-2
brad pitt being investigated for child abuse this all just got really dark,-2
tells me my order will ship on sept 12 arriving by sept 19 today is the 22 lies terrible whereismyfurniture,-3
correction 26 ppl checked in standing at the gate amp flt 1449 took off without us,0
anytime gets near a mic someone needs to smack him w a bat awful marblesinmouth,-2
moment of levity on the b41 baby i want isis give me isis nmom shh nbaby i want isis nwest indian woman she wants what nmom ices,1
the best revenge is massive success frank sinatra,1
warner21 yikes the wrath of maddie,-1
when u only talk 2 me or ask me how r things just 2 get 2 say something u want 4give me if i m not elated 2 start a conversation with u,-2
yeah u gotta make them heel i know u need their votes so u have to wait but when u lose they re really in for your wrath,-2
hyner sadly not one less hour drinking time,-2
candace amp her pout are getting right on my tits gbbo,-2
it s so breezy i love it,3
a 500 season is all i m looking for at this point depressing royals,-3
wrinkling up well now looks here like your name starts with the letter g eh the man smiled up and gave a hearty,2
i know this is going to be one of those nights where it takes an act of god to fall asleep,-2
when something makes you excited terrified thrilled nervous elated amp like you ve been kicked in the guts all at once need word for that,0
eun im really unhappy with this and i dont like her like that pls dont n nyall okay but she loves him,-2
if you ain t watching sugarboy on hulu then you ain t shit hilarious hahaha,2
will whu be old bill free by the time the game with chelsea comes around nthat will be lively to say the least n afc,3
machine keeps beeping nnurse don t worry you re all good vitals are normal for your size n walks back out nmatt so you re dying,-1
i notice that nice people believe in a nice god and horrid people believe in a horrid god who happens to hate everybody they hate,0
evening all don t forget it s robinhoodhour tonight n n bizitalk bizhour southyorkshire mansfieldhour chirp sheffieldhour nottshour,0
musicologist disney s 1994 animated musical film thelionking was influenced by williamshakespeare s hamlet songs by eltonjohn,1
and here we go again restless,-1
mary berry and her reign of terror,-1
caballero having a nightmare sweeperkeepernot,-2
but that was a mistake and a half assed excuse and now here i am burning in hell forever,-2
i m so bored and fat and full and ridiculously overweight and rolls galore,-3
rsa when you click over and over again for a cupcake but there are no vehicles available sadness,-3
you re welcome it s genuinely made me give my head a wobble and realise what s important in life smiling,3
a non permissive environment is also called a battleground milspeak hilarious,1
you charge 150 extra for sending someone out and your cable service still doesn t work that s robbery cable service,-3
backed pats 2 5 10 11 just before,0
3 45am and off to the hospital elouise s waters have gone labour littlesister superexcited,3
alison that part of queensbury is a shocking disgrace the route from the station to morrisons is festooned with rubbish,-3
but losing these games are the worst you end up feeling a mixture of anger and sadness and shame and anxiety and it lasts for days,-3
ima kitchen sink,-1
just preordered the pale ep would have paid for the phone call but i would have freaked out and not said anything,-1
as the birds begin to chirp i try to sleep jetlag,-2
he replied to my comments 4 times now i m shaking omg,1
