Tweet,label
never make a decision when you re angry and never make a promise when you re happy wisewords,1
leon s cheerfulness is always a big help,1
did you even give out any pizzas serious fail hungry hangry,-2
i would just give her with their naked body,-1
bitches aggravate like what inspires you to be the biggest cunt known to man kind,-2
god hears your voice optimism at the moment that you think that everything has failed you,1
srogers n well it can go one of two ways you either get over it and accept it because it s not going to change or you mope about,-2
you make the world a more joyful place thenicebot,1
sioux valley wins home competitive cheer invite with a score of 158 dell rapids second at 138,0
people who go the speed limit irritate me,-2
howard webb always held up as knowing the answers no red sutton and craigan raging hahaha,0
i love to laugh and share laughter as way to share joy,3
with a jovial trump on his ass don king just publicly told a crowd that we need him because you will always be a nigger fucktrump,-3
h0rse i m spry though,0
huff btw ty,-2
what day is it lost,-2
i ve been loving you too long otisredding blues,1
try asking for a cheeseburger with only onion amp mustard at any mcdonalds hilarious,2
something about these cool breezy fall days,3
a not very young man compiled info on a smiling baby then a mattress created new evil,0
food that gets delivered,2
watching avatar and wondering why i took so long to watch this collapses in a joyous heap,3
final night shift coming up i won t miss it but i will miss my work pals and the hysterical laughter that gets us through the night,0
did we miss the fact that burkeramsey swung amp hit his sister jonbenet in the face with a golf club previously out of a fit of anger,-3
do we think the swallows and swifts have gone photo d 3 nights ago not seen since autumn,-1
okay this is hilarious,3
another loss to city in the cup next cmon united,1
i m so confused by the new american horror story,-2
only time i am ever cheering for you johnny,0
but it s so aesthetically pleasing omg,3
ditto such an amazing atmosphere philippplein cheerleaders stunt londonevents,3
huge congratulations to nicole winning big brother 18 bb18 sorry not sorry bitter bbmichelle,0
i m doing laundry and watching that 70 s show with a bunch of strangers happy birthday to me,2
i am irate at you check in system i have tried to checkin all day and it wouldn t let me do it because i had no seat assigned,-2
hello miss lady i m sure today brings you happiness and laughter use your voice also to make us laugh god knows we need it,1
you charge 150 extra for sending someone out and your cable service still doesn t work that s robbery cable horrible service,-3
only geo is capable of cheering me up,1
am i the only person who dislikes fall firstdayoffall leaves thingsdie depressing cold noflipflops,-2
latest on new optimism on keeping raiders in oakland live right now on meets here w lott amp schaaf to talk new stadium,1
harking back to 2012 dt s challenge to i will give dt a hearty thank he will release his tax returns,0
accrington stanley who are they exactly things looking dire for west ham despite the win what s changed since march bbcfootball,0
let go of the need to need and find your own joyous path through the richness that extends in every direction,1
i beg you never stop smiling you deserve to be happy and to know all the beautiful things that life can offers,1
i was just talking about it last week how does your outside appearance ie dread locks affect the ability you have to work,0
try to find the good in the negative the negative can turn out to be good n anxietyrelief optimism openminded,1
lmboo using my nephew for meme,1
i understand your concerns but look at her foundation contributions,-2
well look at the bright side you found a use for that rope tipstosurviveapoweroutage,0
i am beyond the sadness point have done it inside out i live with cptsd and bpd i can t always do the pity party,-2
from here it s but a short step to biweekly community meetings over a hearty meal of soy flakes,1
i know you trusted me his words were soft as he ignored the anger and focused on the hurt beneath i know i screwed up,-1
i have so much hw tonight im offended,-2
is it bad that kurt is literally me glee,-1
look at those teef growl,-1
marotta yea because forcing 5 turnovers and holding a pretty good offense to 7 points is wait no,-2
2401 hannah stop being mournful and chill,-1
wanted to get him a cake with sparkling candles but he doesn t like cake ruins everything,-3
not sure if thats an accomplishment or something to worry about,-1
8 sweater weather the neighbourhood ngirls girls boys panic at the disco,0
but the lady at the store said i had nice eyelashes so that s good right optimism,3
made my night that reid was included in tonight s hilarity some of those points were brilliant thanks murray,3
dobetter only two carriages on 14 49 birmingham to hereford no room to stand anymore friday commute unhappy,-3
lil reminder that my private account is a delight of shittalking and occasionally nsfw stuff,0
jeans with fake pockets horrible,-2
92 what i miss outrage,-2
i would like to know about the source of the president s optimism about running the country i wonder if he can answer my curiosity,-2
some moving clips on youtube tonight of the vigil held at tulsa metropolitan baptist church for terencecruther justice anger sadness,-3
do what makes you successful and happy now and forever,3
one time i saw rachel from glee tell someone their job was on a pole and i said that in 5th grade to a boy and he look confused,0
mine are good rn gonna be horrid after next week,0
do your fuc ing job and report the news just another bully to go in the basket freedom or fear,-3
huh it s always my fault isn t it gt sulk,-2
the guy who calls people cuck and is anti blm is offended by idea that he might not be pro policing reform that s amazing,1
i was like that when i started college it was horrific but it probably will get better don t give up yet,0
i m strong cause i m weak ni m beautiful cause i know my flaws ni m fearless cause i ve been afraid ni can laugh cause i ve known sadness,0
ari looks hilarious oh my g d this is too much,3
wishing the ipswich tigers good luck in their games throughout homecoming week we are cheering you on here at the city office go tigers,3
take 2k out of it the numbers on madden are low and have dropped and people are unhappy,-3
species cf don jr refugees he likes his snacks but even frown on talking about eating humans lizardscum,0
i know i don t know u but physiatrists are seriously the number one best thing for people with anxiety,0
gas prices are hilarious cause they re simultaneously super subsidised and taxed,0
mrs peel lisa might be the pout of a star baker tho,0
she was my favourite such a joyful soul,1
she began to squirm beneath struggling to get out of his relentless grasp when she realized that the attempt was useless,-2
when you wake up from a dream laughing at something stupid and that makes you laugh more,2
maybe it d have been different if i stayed for sixth form but still the oppressive architecture uninteresting people,-2
niggas murking in each other in murky water i try to swim,-2
why do i have such a thing for dark curly hair,-2
i hate post con blues but i avoided the plague too yay yay constant hand sanitizer,0
i get embarrassed at the slightest things and then i ll fret about it all day i hate it,-2
had a coworker look at her phone and say cheerfully oh look kap s getting death threats now then she goes to say the 49ers are,0
to all who follow me whether we ve ever talked or not hope you have a joyous life goodbye,2
honestly depression is kicking my ass lately,-3
he grumbled as he sat atop the sushi bar stool crossing his arms defiantly in a playful gesture though he gave anyone who gt,0
guitar shop owners everywhere rejoice,1
a smile doesn t always mean a person is happy sometimes it simply means they are strong enough to face their own problems,0
god facebook s design has started to remind me of myspace in its heyday,1
whenever you are confronted by a wild animal or hostile individual remember that they can smell fear or the fact you poop your pants,-2
broken policy blasio lt gt trump giuliani broken windows all part of pecking order bully politics america resist motto,-2
it s thursday which means it s grey s day tgit,1
i envy ice at least if you give it warmth it melts taylorlautner twilight hilarious quote,0
seeing double am so tired but i always grudge getting off my phone at night,-2
thank you so much for coming to detroit i m going to sob joyful rainbows now brb,3
moore13 yes exactly amp he s sold out this country to terror while lying to cover it up,-2
dom i often imagine hoe our moon would feel meeting the jovial moons which are all special,0
my siblings look all gangster amp i look all cheery,2
a laurel and hearty handshake,1
yep lol,3
losing the will 2 live with business bb gone down on hold for 23 minutes amp whoever picked up cut me off fuming noworkforme,-3
papercuts sting and stub ur toe last for like 10 secs,0
lmao awe,0
i asked jared to marry me and he said no offended,-3
good master vernon welcome nephews from bellario nthere is my lord that thou interrupt st our merriment,0
thanks for playing crock pot going radio blog blues music indiemusic,3
fellaini has been playing ahead of this let that sink in,0
the world needs more laughter more love and a little more of you r m drake,1
boycotting till butter pecan comes back i am furious,-2
just a shame his world was gloom from day one almost though it makes sense he d have the whole part hydra part s h i e l d c,-2
go follow beautiful snowgang princess fitness bodyposi haircut whitegirlwednesday,3
tiangong 1 china s first space laboratory will come to a fiery end in late 2017 the average decommissioned satellite either burns,-1
cool to see when smart cowboystwitter folks chirp the same stuff you did during your review this is why i joined,1
huge congratulations to nicole winning big brother 18 bb18 sorry not sorry bbmichelle,3
after this news i m supposed to be so damn happy and rejoicing but i m here like,-3
talbot about the dreadful puns i need to get out more i ve been cooped up lately,-2
i was cheering for na team now i just want this is over and gaudreau comes back in one piece it is getting way too risky,0
it breaks my heart seeing people down or upset i will try my best to make them smile or cheer them up,0
the abysmal ignorance frivolity and levity of the italian priests stupefied him roland bainton on luther reformationday,-2
always doing the emotionalhedge w wps n ni m elated about start have i mentioned i m on tamu 6,0
terribledebatequestions has given me so many laughs this afternoon thanks twitter hilarious cleverpeople,3
when s it all finished you will discover that it was never random thoughts restless crossoverlife,0
big thank you for liking my little pumpkin she s the smallest of my 4 but is very playful amp wakes me up most mornings,3
good morning love happy first day of fall let s make some awesome autumnmemories annabailey,3
what s with all pre industrial revolution esque footwear you guys tryin out for grapes of wrath today,0
thanks for ripping me off again luthansa 400 not enough for a one way flight to man from frk then 30 for a bag then free at gate,-2
i just read it and it s so fun so lighthearted and cheerful i was right it s a double cavity for me,2
norwegian quite simply the worst airline worstairline i ve ever used shocking appauling dire dismal beyondajoke useless,-3
followback quote soup be happy not because everything is good but because you can see the good side of everything,0
like i said there s plenty of cheddar in the cheese to go around for everyone,3
is bored exactly what i have been saying on fb bitter,-2
so you were owned by losers on twitter,-3
she blamed benghazi on a youtube video she blamed emails on colinpowell now she blames terrorism on you weakhillary,-2
i will never watch greys anatomy ever ever ever ever ever again if shonda rimes takes away another og character fuming,-3
we re glad to hear that everything is resolved if you need anything else please do not hesitate to reach out to us ty,1
x x do you hear me darn your optimism led your own demise you should zerobot,0
well that draw is lively eflcup,1
just my attempt at levity,0
only god knows why things happen sometimes it s just hard to understand prayingforyou,-1
the little sniffle at the end of the song gets me every time,0
when s it all finished you will discover that it was never random thoughts crossoverlife,0
lt she really said in response to what she perceived as a forced jovial tone with that she slid out of the jeep and onto gt,-2
liking the optimism,0
it s eye for eye indian army never forgives never forgets they always take revenge pakistan breaks laws i a follows,-2
going back to blissful ignorance,-2
already plotting next steps if i get cut off by the same minivan in tomorrow s drop off line preschoolpolitics momthings,-2
smile every morning to a positive head start with your clients relations,3
i ll find myself smiling and even laughing at jokes that i don t even think are particularly funny and i know it s because you love them,2
my haters are like crickets they chirp all day but when i walk past them they shut the fuck up my idol,0
thinking about trying some comedy on youtube always been fond of it time to nut up comedy maybeoneday hopefullyfunny lol,3
it hasn t sunk in that i m meeting the twins,0
lydiaaaa we were the only ones that were supposed to know that you make me nervous,-2
baby happppy happppyyyyyy happppppyyyyy haaapppyyyy birthday best friend love you lots chapter22 bdaygirl love,3
i admittedly went into this series thinking we d see the jedi in their heyday not as dysfunctional un peacekeepers in space,-2
please tell us why protesting injustice requires burning beating and looting terrible optics toussaintromain is true leader,-2
have some issues with my broadband bill i am charged for the month before i signed up with airtel hilarious,1
what happened to breezy,0
brennan cook and breezy should get back together,1
who actually chooses to drink sparkling water,0
the true way to render ourselves happy is to love our work and find in it our pleasure francoise de motteville,1
im like this is better in the moment cuz i panic and then later its so obviously not better at every opportunity i choose to make it seem,1
well my evaluation came back and i am minimally effective student test scores on the parcc sunk my eval it s time for me to quit teaching,-3
ob we sound like vampires saying we wanna sink our teeth into the tt lads and their talents,1
getting my comedic relief w during season premiere of modernfamily just what a girl needs hilarious,2
aw no problem i just felt like speaking because i felt the same before and i want you to overcome it and not be discouraged,0
ciara asks was it a sci fi movie julie amp jen just stare claire on her phone joey bolts when the cab honks lmao,2
i have no clue where my charger is lost,-2
bridgetjonesbaby is the best thing i ve seen in ages so funny i ve missed bridget love teammark,2
gets crushes on fictional and animated characters instead if real people,0
she s foaming at the lips the one between her hips one of many great lyrics,1
the bushes were good with the forces of resentment when it made them money and gave them power now that it doesn t they ve changed tunes,0
oh please inc talking about looting i m not saying bjp is pure but this is such a hilarious irony is def better,1
pakistan is terrorist state carries out war crimes india to n unga un,-1
not by wrath does one kill but by laughter friedrich nietzsche friedrichnietzsche,0
if payet goes either in jan or the seasons end can t say i blame him the boy must b so disheartened by what he s seeing at the mo,-3
the jovial laughter that trump and his lackeys showed when don king used the n word was a truly bizarre sight,-2
reflection the grind has been so real working 2 jobs amp being in school ksudsm ksu recruiter instructor tumble cheer gradschool,2
specific amp intentional way and part of that intention is to provoke conversation around systemic racism towards blacks,-2
and with rich fumes his sullen sences cheer d,0
n ropes can t believe how rude your cashier was today when i was returning an item your customer service is slacking,-3
mxe7 hah don t speak to me or my cousin like that mind a had the displeasure of seeing u bare faced on eh train no a pretty sight mate,-2
can be as indignant as he wants but the world knows obama will do nothing and putin will just do what he wants aleppo syria,-1
all i ve seen is that clip of the jail scene with the sexuality part which was hilarious,1
clean the sink and make your bathroom shine,0
take my kindness for weakness when you acting silly keeping it 100 ain t your fort breezy chrisbrown teambreezy,0
grateful for all the hungry people in my life hungry to learn change grow help etc not sure anybody has it better relentless,3
now that the n word is normalized by the media just wow no words for this no words for this frog been boiling in the pot via media,-2
great to hear if there s one thing that makes you feel more like yourself it s some hearty chicken noodle soup right,0
i feel so blessed to work with the family that i nanny for nothing but love amp appreciation makes me smile,3
easy breezy beautiful rasta mon,0
pre game nerves have settled in i l be cheering from home guys aflcatsswans proudlysydney goswans,3
never let the sadness of your past ruin your future,0
don t put famous dex in a tweet with breezy lol chris is that guy dex a bitch lmao n music ass,0
love this laughing while crying works too katherinemansfield failure dealingwithfailure,0
every time i hear s organ kick in on the new i break into the goofiest smile,2
have the producers of ever been outside of their country these are universal problems worldwide anxiety,-2
operation echoes is gathering momentum tense nervous feelsick excited,0
if you re unhappy with someone just fucking tell them you re unhappy and leave don t go fuckin around with other people on the side,-3
all the best moto gp is loosing a very talented rider,-2
can you at least just walk past her and break out into laughter,0
all the optimism,0
this tweet is dedicated to my back pain which i do not understand because i am youthful and spry full of life vivacious,-2
im love you even if you bully me sadly,-1
tutoring gives me such an exhilarating feeling i love helping people,3
every time a new anthony weiner revelation breaks bill clinton says a prayer of thanks that texting dming didn t exist in his heyday,-1
rooneys fucking untouchable isn t he been fucking dreadful again depay has looked decent ish tonight,-2
jesus you just made think that of all the vols v fl games i ve seen i ve never seen a win depression,-3
sadly it s just did the dude have to yell out the frogs name at the clinton rally that one day it changed everything,-2
hey breezy you wanna give me some of that coffee you posted on your snap please,0
best quote from a 7 in german almost,0
offerman i ll be there can t wait for all the mirth,1
the most important characteristic of leadership is the lack of fear activism equity revolution,1
twd comes on soon,1
15 minutes of yoga to your breakfast routine will change your day preparation sunriseyoga bodyawareness health yoga smile stretch,3
vas a ir al de the amaity affliction,0
it s not the most comforting amp jubilant place to be but i do find joy in doing what s best for me and being passionate abt company i keep,0
did u laugh today laugh hard i hope need laughter now smile love,3
watch this amazing broadcast by bridges lively musically,1
still bitter about last night lads,0
i m just doing what u should b doing just minding my business and grinding relentless,-2
any possibly kg is being bought out as a player so that he can buy in from glen as a minority owner,0
smokeys dad is sad,-3
rockin to bob dylan singin bob dylan s 115th dream on lpco klassic rock classicrock klassicrock rocknroll blues onlineradio,1
did u laugh today laugh hard i hope need laughter now love,2
pretty average klitschko fury did about 600k and joshua white did about 450k,-1
i know few will mourn the loss of stitch s great escape this is the kind of cost cutting at parks i really don t care for,0
huff i know your pro hillary and so is cnn and msnbc but they made no mention of this this statement would be gold for em,-2
learning is key while converting your leaning to someone else is door so when you do both you will open the door of success n n x33,1
i bet dat dog eating name brand cheerios cant relate i eat cheery o s,-2
need a new outlet for,-1
isn t that the reason horror is popular the exhilaration that comes from discomfort is enjoyable watch the green room d,1
if ydu yell fire in a crowded theater you will burst into flames it s a cool trick bu only once,0
my liver is elated that isn t us,0
how sad is it that i m rejoicing over a 72 collegekills,-2
you got this staystrong smile yourebeautiful,3
so happy my next class is canceled od tired,0
aw there s a young fox outside on the grass just jumping around all playful and having a little stretch soo cute,3
evidently feels above norms show the tax return if you have nothing to,-1
mou is too jovial and trying to impress those players too much no player is bigger than manutd saf won t tolerate all this bs,-1
i m still laughing bitch took my pillow line glee kurt,1
i know if i wasn t an optimist i would despair,-2
it was very hard to stifle my laughter after i overheard this comment it really is amazing in the worst ways,1
i don t know why everyone is pretending to be sad about angelina and brad everyone knows his dumb ass should ve stayed with jennifer,-1
a shy failure is nobler than an immodest success,0
but guess what i m sober,-2
2 applications for my dbs and still waiting been over a year now going to loose my job thanks unhappy crb,-2
happy birthday 56 cheerchick jeep jeepgirl idriveajeep jeepjeep cheer,3
cpc the single tear is him being joyous that he s deleted the monster that has brought generations of despair,1
if man u lose i may actually have a nervous breakdown,0
gayz high fantasy i feel like you could make a melancholy college age slice of life thing work too,-2
loving pitch so far tv chills,2
my friend just messaged me ugh i m so hungry i can t wait for breakfast socialmedia winewednesday funny laughing,3
accept the challenges so that you can feel the exhilaration of victory george s patton quote yeg,0
star trek online has a update to download oh fuming yay,1
crying because s snapchat is bringing on some serious glee feels,-2
a not turning up why am i not surprised late for work again,-1
benefit out exhilaration called online backing off jkuvmvqxy,1
not the best horror ever but i like that the uncertainty,0
even if it looks like we are okay the reality of that is were actually very worn out and forlorn,-2
me being on my dean really saving a lot of ppl bc i don t snap nomore amp it take so much out of me,0
i d pay good money to watch someone slap that pout off candice,-2
i m due for a big change i ve prayed on it i think i deserve it positivity,2
thank you for teaching me how to live again it s been so long since amp this ride is about to be exhilarating i just know it,3
the banter from craigen and sutton on bt is fucking horrid,-3
i am a third year college student and and english major today is the first time i ve ever written an essay without having a panic attack,2
swear all of my guy friends are scaredy cats you don t do horror movies you don t do haunted houses wtf do you do then,-2
don t ask you don t get apologies if i ve offended you all due respect alan i think you ve been fed duff info,0
scott dann injured aka my worst nightmare,-3
rooney needs to come off absolutely dreadful class goal from showing why he should be in the team,-2
thank you for the balloons today goodday 48,3
bilal abood iraq immigrant who lives in mesquite texas was sentenced to 48 months in prison for lying to the feds about terrorism,-2
mmmm i m kinda sad i hope i can shake this before school,-3
catherine happy anger sad melancholy confusion woodspurge,-2
can t wait she said cheerfully and grinned,2
a liar an a bully for president they say every vote matter well i m sorry you ll not get my vote until the year 2020,-2
snap meee,0
i know i ve painted quite a grim picture of your chances but if you simply stand here we will both surely die,-3
first weekend of fall let s see if i can stay disciplined to this seasons goals fitness running sober mindset firstfriday family,0
i swear people dont wanna see me happy like they will try to do anything to fuck up what i got going,-2
and i would advise that everyone wait to watch or actually don t wait just don t even watch it because it is awful,-3
old fish discourage,-3
i don t need a mask but i ll gladly make a donation to help in ur name is it mr ty rex or first initial only serious,0
our tone of voice we re like one direction we re thoughtful and timid yet playful,0
go follow me on musically i am making a lively come and join bffing and following see you there,1
elinor she laughed so little known all over every body at the brilliant cheerfulness of sweetmeats and a fashion,1
the quarterback wrecks me every time glee,-2
rip30 heaven is rejoicing because they ve gained an angel the keifer family are in my prayers,0
i was injecting a little levity the person who tweeted the coke rape tweet is obviously an idiot,-2
yell bye garbage cheerfully after it,-2
when your rewatching glee and break down in tears all over again glee,0
that was exhilarating hockey they re still out if russia wins in regulation i m reading fuck,-1
peanut butter you some kinda pervert awful,-3
i don t know how people can binge watch horror films alone,-2
