Tweet,label
yeah playing well,0
at least i don t have a guy trying to discourage me anymore in what i want to do he will never become anything worth contributing to society,0
uplift if you re still discouraged it means you re listening to the wrong voices amp looking to the wrong source look to the lord,0
your age the heyday in the blood is tame shakespeareaninsults hamlet elizabethan williamshakespeare,0
i was so embarrassed when she saw us i was like knvfkkjg she thinks we re stalkers n then she starts waving all cheerfully inviting us in,-2
really planned on making videos this week then a tv died phone broke truck died depression took over i m wondering what i did 2 karma,-3
i hate having ideas but being too afraid to share them,-3
at the regular cheerfulness of any emotion her own supper and to give the ladies were soon as they have been entirely at,1
a pessimist sees the difficulty in every opportunity an optimist sees the opportunity in every difficulty sir winston churchill,1
just because i m hurting ndoesn t mean i m hurt ndoesn t mean i didn t get nwhat i deserved nno better and no worse lost,-2
i cancelled by cbs all access live feeds before jc even said vic won afp have won imo bitter,-2
for what a beautiful day,1
we have been a better second half team this season so there s that,0
back to forest drama nfrom my forest music series 2016 n nature dark art photography finland,0
much sadness and heartbreak,-3
i have learned over the years that when one s mind is made up this diminishes fear rosa parks quotes motivation,0
walk right through them see way past them and don t even hesitate running them over,0
it looks cool and animated well for pixel art,2
over 70 of social sharing is dark amp over 50 of web traffic comes from darksocial liftsocial,1
communitysleepcoach look at these narcoleptic puppies make you smile if you are human amp find yourself in such odd positions seek th,2
now that i have my future planned out i feel so much happier goals life igotthis yay,3
hate going to the doctor on so many levels but least i can go sleep with a smile just watched dwight on live nation,1
happy birthday lost lost dharmainitiative 12years 22september2004 oceanic815,0
people too weak to follow their own dreams will always find a way to discourage yours,-2
sadly beautiful photo,-2
peanut butter you some kinda pervert,-2
my baskets are better when i m in a bad mood someone irritate me before practice please,-2
remember the life you have is a blessing for god make it a joyful experience regardless of the odds gby,1
fucked my coupon that goal,-1
it s always depressing to sort wordpress plugin recommendations not by best but by least offensive in terms of premium features,-3
and it s gleeful because they re so inspired so convinced they re winning and at last have their strongman,0
catering channel s at the height technics hearty enjoyment symptomatize vrlfeyrn,1
the best revenge is to get yourself a good woman and move on leave her and her hairline to figure themselves out alone,0
the forth character no not gleeful enough,-1
my view of the human being is as a dynamic expression of the cosmos we exist within humanism awe,0
yesyesyes like jd is the closest cahracter that is similar to blaine the optimism and ability to crack tough characters,1
m203 yeah they figured that ornaments are way more wanted than spektar and desolate gear well they thought right,0
hey nascar fans are you going to the race in loudon this weekend why not stop by new day diner for a great hearty breakfast before you go,1
love your new show,1
oh almost with odd cheerfulness big boss offers muzzle flash blinding accidental by the guy who became my best friend,0
easy breezy beautiful,2
being in the countryside all day was so pleasing,3
ing you asshole you made me sexually attacked to a animated bear p,-2
they re both pretty awful when you look at them historically,-2
those sparkling looks like a gay vampire,1
what do aquila ajahnae and euriechsa have in common besides ridiculously stupid horrible ugly god awful names tracey is not their father,-2
aww thank you i m definitely feeling much better today and your messages cheer me up too,2
the t i shawty lo beef is one of the more underrated ones in hip hop history chock full of wit bravado and hilarity,1
and you as well sparkling,1
ball watching amp rojo d header was equally dreadful,-2
for every minute you are angry you lose sixty seconds of happiness ralph waldo emerson quote,1
charlotteprotest do u wait 4 the facts video or do u hate now ask questions later protest policeshootings suggestions,0
please bear with me i m not twitter savvy in real life i m a facebook person help me gain followers blog selfhelp,0
and here we go again,-2
i found marmite in australia happy,3
misery loves company the church ought to be a place where it finds none n pastor kris theobald joy rejoice,1
does this blow your mind as much as it blew mine or did i just sexually harass someone whoa mindblown huh setback fright madashell,2
he has bad temperament hissyfits,-2
looking like in his heyday,0
susie they ain t going away and i don t want to see them hurt changing hearts minds is really our only option no,-2
i m doing laundry and watching that 70 s show with a bunch of strangers birthday to me,0
that s my breezy breezy breezy that s my breezy that s my buzzinnnnnn,1
never make a decision when you are angry gt lt and never make a promis when you are happy,0
you made me cry and shake to the point where my parents had to calm me down and give me calming tablets,-3
a delight to be at the lane tonight and witness the debuts of some young talent that could be the backbone of our club coys,3
i can never find the exact emoji that i m after at the exact moment that i need it panic,-2
ah but once i got it to work there was much rejoicing lol thanks will get it to do taht now,3
wakes up and says have you tried changing her nappy,-2
praying for the lord to keep anger hate jealousy away from your heart is a sign of maturity conciseness,-1
never let me see you frown,-1
your ux online is appalling no clear save button not being able to use any generic tld s unhappy,-3
more of a hearty italian man myself,0
not a word about terrorism,0
we ve had no foreign policy but have had goofy secretary of state john kerry with his devil may care pose and jaunty blue scarf,0
very long day thank goodness for bake off to brighten up a weary wednesday gbbo,0
when you wake up from a dream laughing at something stupid and that makes you laugh more hilarious,3
hope was an instinct only the reasoning human mind could kill an animal never knew despair,-1
don king is an insult to the intelligence of the black community what are these people thinking,-3
my first time watching your vids and i died of laughter keep this up dude,3
its okay to be trans just rejoice with the trans in the trans way by the way it s not your business so why care,0
omg i actually thought she was going to jump southpark20 southpark,-2
glad to see that you re having fun in the sun water sports are always fun challenging and exhilarating happiness beauty,3
this whole vanre extradition might turn into a pandora s box jt has no idea about that murky corrupt guanxi in china toad vs dada,-2
body is sleepy but the mind is active so sad have to get ready for work in 30 minutes damn restless,-3
the lord your god is in your midst a warrior bringing victory he will create calm with his love he will rejoice over you with singing,1
personaldevelopment n ntoday is a gift that s why it s called the present happiness optimism entrepreneur personaldevelopment,3
nice idea collect all relevant socialmedia in one but dont be automatic pls worldsapp chirp appsworld socialmedia merci,0
i can never find the exact emoji that i m after at the exact moment that i need it nuclear missiles n n indianarmy,-2
brendan rodgers looks fuming,-2
cn seems like you only appreciate good reviews no apologies to my concern years ago,-2
my friend just messaged me ugh i m so hungry i can t wait for breakfast socialmedia winewednesday hilarious funny laughing happy,3
i am always ready to smile,2
any time a man who got paid to throw temper tantrums speaks up you gotta listen,-2
it s the irritation of not having found the corpse,-3
like i said there s plenty of cheddar in the cheese to go around for everyone smile,2
i m mad that my brother is sad feel better bub,-2
it s so sad there s always such optimism with a new year this good,-2
one thing i can say is that you kept me smiling,3
it s meant to be,0
your lion s heart nwill protect you under stormy skies nand i will always be listening for your laughter and your tears,1
lets get this astros a s game going already we re going to need all 5 of you in attendance to cheer the a s to victory,0
well that was exhilarating i didn t know you could have goosebumps for 2 hrs 5m straight,2
bet pawpaw is having a good time rejoicing up in heaven for his first birthday there,0
vincent looking super lively boy hattrick perhaps lol,1
in health we did a think about depression and now i feel like i have it,-2
ufc what happened to the suicide tweet it was a joke obviously how could that offend anyone,-1
i hate little girls got a lot off growing up to do fuming,-3
i am working on a feature right now about the preponderance of awful owners who are at war with fans so many to choose from,-2
it take so little to make a child s life joyful why do we work so hard to make their lives hell peace,0
omg i m outside making beats with garageband and some little birds decided to chirp along,0
sadly his best days are behind him,-2
only offering 6 moth warranty ps4pro shocking truth ripoff,-2
ok it seems there is still hope in bsnl nnow bb speed is ok nbut i won t thank and elate much lest it be gone again like before,0
chirp chirp what a beautiful white and red bird,1
thought it d be fun and it is not fun but on the bright side i don t have to fight for parking,0
it s been 5 weeks and i still go through depression smh,-3
huh we have a sprint coach we re the slowest team in the comp talk about robbing a living outrage,-3
i wish i really truly wish that i had just a modicum of your banter,0
use your smile to change the world don t let the world change your smile quote actorslife smile love hardworkpaysoff fun,3
one point dsp claims yters lost half their viewership in 2012 if they weren t using direct capture that s when the search changes happened,0
obama describes his temperament as steady amp on the buoyant side,-2
the joyous occasion of laughing at the ostentatious display of disrespect bruce just scoffed at the entire scene this wasn t batman s,0
the current run of superman continues to be a delight you can feel the love poured into it by everone on the creative team superman,3
come to the fundraiser this fri at 8pm because pie face,1
that is noah ark it s a terrific design,0
i m a cheery ghost,1
did you know that the sparkling letters in super mario galaxy spell out u r mr gay,0
red heads are more fiery,0
solid starts by bozzelli and benevans hoping for a good start,2
relive vegas heyday with rat pack tribute,0
it s buzzing pathetically for sympathy if you let it out it will twirl it s moustache chuckle and sting you psychowasp,0
job interview in the afternoon ek,0
today i answered a call from a college rep who didn t realize i did and i got to hear part of his lively debate about if evolution is real,0
i ve got some new pens to break in name an animated series and i ll draw you in that style,1
if i spend more than 10 in shimmy on 1 drinks i ll be raging but we all know it s gonna happen,-2
terribledebatequestions has given me so many laughs this afternoon thanks twitter cleverpeople,3
just now we were rejoicing that we finally won a match the draw just revealed that we are facing city next this life sef,-1
i thought i got mad for anything but my bf gets mad over any little thing lmfao shit be hilarious,1
i seriously hope these chances celtic are missing are going to come back to haunt them with an alloa sucker punch,-1
i cant live anymore my roblox got termianted sad killme lol robloxgamer,-3
naylor connie came back in hey you seem a bit more lively,0
in my dream they were trying to steal my kidney blackmarket whydidiwatchthat,-2
obama admin rejects texas plan to have refugees vetted for terrorism so texas pulls of of fed refugee resettlement program aiding,-2
just joined pottermore and was sorted into hufflepuff,-2
impractical jokers practically genius laughter good4thesoul impracticaljokers bingewatching,2
nana 4 hoco bc my dream since freshman year awe,2
he chirp,0
the ghost of stefano reflects on the grim indignity of being murdered by corrupt cops in faux love days,0
just like there is a right way to pray there is a right way to give not grudgingly or of necessity but cheerfully woficc,0
guy across from me in a really ugly suit cannot stop expressing his displeasure,-3
f breezy,1
turns out it wasn t even anything to be concerned about at all im happy and a bit frustrated it took so long to get this answer,0
bojack horseman the saddest show ever written depression season1,-3
dehydrated exhausted stressed but still blessed,0
i want my highlight to be so bright that if i ever get lost and someone is looking for me in the dark they ll find me,0
appreciate what you have amp enjoy your life nuse your smile to help others use theirs,2
what if the metro lrt went over the walterdale yeg,1
we love you hilarious we are looking forward to so much more kudos on the pilot abc speechless,3
a former diplomat is quite gleeful about the situation of pakistan on nnot quite stiff upper lip of diplomacy seen normally,-2
sigh i got a b depressing,-3
trust me dear if you want to make anything invisible hang a wet paint on it and hilarity will ensue,1
asked one thing from our guys tonight and got it happy proud disappointed that is football timetoclimbthetable,0
when we give cheerfully and accept gratefully everyone is blessed maya angelou,2
when you re prof suggest and william james may be unlikely dialogue partners and then plays the happy video wearecst,1
be strong independant and practical stop living in your world of fantasy snap out of it the faster u get used to the reality the better,0
beats is accurately all powerful with respect to high quality high frequency speaker in re the extra desolate relating to fire ea,0
i was pretty sure it was a golden ticket get a tour make a mistake something horrific will happen to you good day sir,0
ha right i m from san jose ca and i was offended right there with you dave go on a walk or something next time,-2
sweet optimism,1
repeal remove the johnson amendment it is a direct affront to the first amendment of the constitution,-1
so they threaten to kill kapernick for kneeling i say every athlete just stop playing until social justice and equality comes forth,-2
love that jordy revenge,0
mind if i tag along she asked cheerfully sweeping a lock of hair behind her ear i want to see if you ve really got,0
everyone hates twice and i kinda did too but they got bops i m bumping rn to cheer up,0
just watched django unchained other people may frown but i titter in delight 2 5,1
i just want to let everyone out there know you are wonderful people beyourself late night compliment behappy,3
tityboi bc it s a gloomy day tony,-3
my adorable and cheerful daughter nalways pouring positivity green goo on me ndare hurt her and you ll see hell growls n n pandabot,1
you ll be pleased to know my family are blues,0
are you lost in the fury fearing that you ll fail,-2
some of the casuals tweets that vic has faved are making me gag bitter,-3
tonight legit can t wait to rage,-2
ya boy gets mad tired of pine trees,-1
mc what are you listen to these days nbogum these days i feel gloomy i listen to ccm spiritual song often n nchurch oppa mode,-1
i can t help but feel melancholic,-2
i assure you there is no laughter but increasing anger at the costs and arrogance of westminster,-3
heads melted very tired but can t sleep nightmare,-3
this is why i think his pre prepped debate answers have the potential for hilarity,0
once again the only thing on my feed is naay raging about something and my brother filling in all the gaps,-2
women don t like girls because we resent them for looking so great we wish we still looked like that washed,0
the outrage has passed and has been replaced by a mute fatalistic acceptance of the current situation fatalism,-2
sports top seed johnson chases double delight at tour championship,0
buhmaid happy birthday sweety sweet 21 hun hope u have a wonderful day and a wondrful joyful year better than the last one luv u,3
covering milo might make sense not much even at that but celebrating him as puckish is cooperation in something ghastly,-2
aidy has a physics question naidy ok i m not gonna ask tristan cause i don t wanna aggravate her,-2
meogysdailyvocabenhancment elation quality or state of being elated feeling or state of great joy or pride,1
i can t pull myself out of depression,-3
lol love it when you aggravate juan keep up the good work lol,0
aww i had a maine coon when i was little named ted eddy the wonder cat they re such good cats very playful and sweet,1
please fire don lemon do not let him report on anymore protest he is horrible negative and runs away from the issue at hand,-3
cheering for wch and men,1
afternoon delight,1
no greater wrath than a woman scorned,-2
when my friends send me ballons and fireworks through text amazing,3
loved sing tiff but 1 q there is 1 japanese line but obviously spoken by non japanese no way to find japanese for 1 line,0
i would like to congratulate the people of saudi arabia a happy and a joyous national day may you all have a great time,2
you know you re in love when all you can do is smile whenever you talk about how he is to someone,1
traditionalists say it should be bored by or bored with but not bored of a rule cheerfully ignored,0
drunken patroons make this whole situation much more jovial though,0
i understand it s not pleasing to the it ain t what you want i m so so tired,-3
optimism leads to success bill kerr kerr success optimism goals,1
being stuck in the roof of your house provides amazing view but sheer terror of falling down kinda like life,0
you forever straight so fix that frown u good,1
mon celtic give us something to cheer place is empty soaked amp its my wee nephew s birthday ffs started well now dropped off,0
5 person of renown cheerful expectation solutions pleasure principle back hsnhzmjsc,1
oh so that s where brian was where was my invite offended,-3
why does having anxiety drain some much of your energy anxiety sotired needtosleepforhours,-1
kellydodd tamra would f her up if she swung on tamra nkelly is a piece of needstobeadmitted,-2
i aspire to have val s self confidence and optimism tbh gbbo,2
scorpio s can withdraw to a quiet place after being hurt only to think of a plan to sting back,-2
circle k is dead to me i hate your new slushie machine livid,-2
if i were assured of your eventual destruction i would in the interests of the public cheerfully accept my own sherlock holmes,0
on the bright side with youtube heroes leafy will finally get banned,0
breezy luvvvv,1
i love looking at my old statuses on facebook the one i have from four years ago on this day was about glee i had so many opinions,1
incredible that anthony weiner has been caught chasing a busty milkmaid across a park at double speed while jaunty music plays,-1
yes i am rejoicing,3
stepp any other election fine vote 3rd party as useless as it is but not this one i hesitate to say it d be selfish but,-2
wch nhlnycsweepstakes having fun watching team north america and cheering team canada,2
hey why can i only see 15 sent emails where s the thousands gone,-2
heard of panic at the disco how about kach ing at the atm,-1
i can t find my patronus the website doesn t work i can t even see the questions sadness,-3
in geometry today hannah started crying of laughter because ms canning said pp lol,2
i d rather dump gasoline all over myself and run into a burning building than use excel,-2
so in your opinion is this the worst delhi govt acrid hypocrisy,-2
my heart actually sunk looooool i was so confused,-2
tell that to your bodies cheering on the deaths of black people by cops their fear is killing us,-2
i m 3 days sober don t wanna ruin it,0
a 28 yr old man threw a saucepan of boiling water at a garda amp then hit the garda with the shaft of a brush letterkenny district court,-2
thank you for the follow looking forward to your tweets as they look entertaining socialmedia,3
ppl like that irritate my soul,-2
the hunter in this way content and joyous in simple domestic bliss i cannot wait for word of who you truly are to,1
fam what seems more fun for a photo booth being able to instantly post to twitter or having to wait till sober to see the hot mess,0
sir my concern is not whether god is on our side my greatest concern is to be on god s side for god is always right abraham lincoln,0
yes mourinho you really should stop speaking about refs and try cheering up a bit,-1
bridgetjonesbaby is the best thing i ve seen in ages so funny i ve missed bridget love hilarious teammark,3
these people irritate tf out of me i swear i m goin to sleep,-3
yeah paul glorious bb18,1
smiling doesnt necessary means your happy sometimes it just means you re strong,0
whatever you decide to do make sure it makes you happy,1
some erykah badu to sedate me,1
i totally understood his point but we need a better messenger and the laughter just pissed me off,-3
at the end of the day you gotta be happy for you,2
girlfriends cooking me dinner again spag blow it is not to sure if she need my help girlfriends happy,3
candice s pout gets more preposterous by the week this week it s gone a bit jack nicholson s joker gbbo,-2
it s 5679787 cannot dm you as we don t follow each other not such a party fail letdown,-2
thinking about trying some comedy on youtube always been fond of it time to nut up laughter comedy maybeoneday hopefullyfunny lol,3
since the update my loses power nearly 40 faster,-2
too many are on their yeah the thing going on with cops shooting innocent people is sad but just not in my backyard so blm,-3
gud morning sir keep smiling,2
hallospaceboy i respect when someone can give a second chance to a movie they aren t a fan of why horror is diverse,0
jamiebraidwood haha horrific is all that needs to be said glad i m away to spain on sat so missing game,0
the ppl on here defending cops as they continue to kill innocent ppl or ppl who aren t innocent but clearly cooperate irritate tf outta me,-2
mate the thing i get excited about in my profession are mad a client said she opened her bowels i m rejoicing,2
happy birthday to the most beautiful cheerful sister ever llnp,3
seriously digging those eyebrows,0
wine drunk is the worst version of myself ffs don t even remember seeing basshunter,-3
violently screams at the four winds we aint ever getting older cute jovial rhythm starts moves hips along and waves arms in the air,1
hahahahahaha oh gosh you are hilarious a black man trying to keep racism alive get out of here man,2
he just has that way of thinking he wants absolute hope born from absolute despair,-1
my ukulele bag has fallen apart welll at least my life hasn t yet,0
your gunna make me cry i need a glee day,-1
hey why can i only see 15 sent emails where s the thousands gone panic,-2
myself that despite the absolute delight my children and i would feel having a kitten in our home the misery my husband would feel is more,-1
super shitting it about this tattoo nervous,-2
i love those memories that randomly pop ninto my head have me smiling like an n idiot for ages,3
smiling through the stress,0
my future must be bright af,1
why tf do broke boys keep tryna find gf s get ur fuckin right b4 i smack yo bitchass she deserves 2be happy amp u don t deserve that ass,-2
every single problem we ever face can be solved with a nice blend patience and optimism,0
eastwick just play rappers delight and have a 15 minute kip,0
looks that way but let s think about rohan last week optimism,2
this night is sparkling don t you let it go ni m wonder struck nblushing on the way home,1
some say my lover is a pale green light nhe hovers high where the moon shines bright,1
got to be up in 4 hours to go back to work cantsleep excited,2
but sadly he missed some crucial and important points indian terrorism in pk kal boshan etc raw involvement,-2
light shining thru a clear sparkling stream of piss is a sight women will never know of also tells tht system ure system is healthy,0
don t join they put the phone down on you talk over you and are rude taking money out of my acc willynilly fuming,-3
heather that was hilarious anthonyweiner 15gets20 nyc,3
james did it not just enliven your soul,0
dentist just said to me i m going to numb your front lip up so it ll feel as if you ve got lips like pete burns she was right,0
in my room 101 would go russell howard tom odell michael buble pants nogood dire,-3
so happy i live in nyc see you tomorrow,2
awe miss y all too,0
never a dull moment when talking to nell,2
congress attended by midterm liveliness differently constraints qmiv,0
impossible to say we can only hope that i don t unwittingly trigger her ferocious side again hell hath no fury,-3
i really hate mel and sue they think they re hilarious and they re just awful,-2
i was just introducing a little levity to the convo yep,0
gonzaga not listed in the article but at 65 1 they have tremendous value they are top10 team for sure got everything you want,0
home is where the heart lies love my little island but my birth city just ain t acting right amp im not feeling too good about it restless,0
tom phillips being all jovial at the start of this week s show when joe is strutting out after that video package is quite the juxtaposition,0
bloods boiling,-2
